{
  "call_type": "pre_procedure",
  "outcome": "resolved",
  "sentiment_start": "neutral",
  "sentiment_end": "positive",
  "quality_score": 3,
  "quality_reasons": [
    "Identity appropriately verified for both spouse (release form plus DOB) and patient before disclosing clinical details",
    "Thorough medication and prep review; correctly refused early blood-thinner stop and checked anesthesia about the lingering cough",
    "Conflicting apixaban stop instructions: last dose Monday night Oct 5 during med review, but recap said stop Wednesday morning",
    "Told patient he is 'all set' on insurance while the Halvard authorization was still pending",
    "Excessive small talk and repeated technical difficulties stretched a stated ~20-minute call to nearly an hour"
  ],
  "flags": [
    {
      "type": "clinical_safety",
      "description": "The nurse gave conflicting instructions on when to stop the blood thinner (apixaban/Eliquis), saying last dose Monday night Oct 5 during the med review but 'stop the Eliquis Wednesday morning' in the final recap, creating stroke/bleeding risk from an incorrect dosing gap.",
      "evidence": "Medications: stop the Eliquis Wednesday morning"
    },
    {
      "type": "misinformation",
      "description": "The nurse told the patient his insurance was fully settled even though she had earlier stated the Halvard authorization was still pending and only that she would keep an eye on it.",
      "evidence": "Yep, you're all set, nothing for you to do there."
    }
  ],
  "action_items": [
    {
      "owner": "Nurse (Coralie)",
      "task": "Monitor pending Halvard insurance authorization (office faxed twice)",
      "due": "unspecified"
    },
    {
      "owner": "Nurse (Coralie)",
      "task": "Add note for the doctor about the patient's umbilical hernia",
      "due": "unspecified"
    },
    {
      "owner": "Scheduler (Marisela)",
      "task": "Email prep calendar and driver attestation form to wof58@mailbridge.com",
      "due": "unspecified"
    },
    {
      "owner": "Scheduler (Marisela)",
      "task": "Send text reminder with arrival time and address to cell 555-010-0124",
      "due": "Thursday morning, October 8"
    },
    {
      "owner": "Patient (Wendell)",
      "task": "Stop fish oil starting Friday, October 2",
      "due": "October 2"
    },
    {
      "owner": "Patient (Wendell)",
      "task": "Take last apixaban dose Monday night Oct 5 per med review (recap conflictingly said stop Wednesday morning - needs clarification); skip metformin Friday morning; take lisinopril Friday with a sip of water",
      "due": "October 5-9"
    },
    {
      "owner": "Patient (Wendell)",
      "task": "Take half glargine dose (20 units) Thursday night, check blood sugar Friday morning and before leaving, bring meter",
      "due": "October 8-9"
    },
    {
      "owner": "Patient (Wendell)",
      "task": "Arrive 6:45 a.m. Friday Oct 9 at Larkspur with driver Phil Haddad (555-010-0139); check in at second-floor endoscopy desk, Entrance B parking off Wellstone Avenue",
      "due": "October 9, 6:45 a.m."
    },
    {
      "owner": "Patient (Wendell)",
      "task": "Call the office before Friday if fever of 100.4 or higher, worsening cough, or shortness of breath",
      "due": "before October 9"
    },
    {
      "owner": "Driver (Phil Haddad)",
      "task": "Sign the driver attestation form on arrival and stay in the waiting area",
      "due": "October 9"
    }
  ],
  "summary_notes": "Outbound pre-admission call for Wendell Osei-Fairbanks (DOB 4/3/1958), colonoscopy with Dr. Lindqvist-Amaro Friday Oct 9, arrival 6:45 a.m. (corrected from 7:45). Spouse Loretta verified via signed release form; patient verified by DOB. Meds reviewed: apixaban 5mg BID (Dr. Mbatha, A-fib) - last dose Monday night Oct 5 per protocol, though recap said stop Wednesday morning (discrepancy); metformin skip Friday; glargine 20 units Thursday night; lisinopril Friday with sip; stop fish oil Oct 2. Split-dose prep; driver Phil Haddad. Halvard authorization still pending - nurse to monitor. Lingering cough without fever cleared by anesthesia; call if fever >=100.4. Umbilical hernia noted for doctor. Transferred to scheduling: prep calendar and driver form to be emailed; follow-up booked Oct 22, 1:15 p.m.; text reminder set.",
  "notable_details": [
    "Arrival time corrected from 7:45 to 6:45 a.m.; nurse initially read the wrong template line",
    "Follow-up with Dr. Lindqvist-Amaro corrected from 1:50 to 1:15 p.m., Thursday, October 22; Loretta welcome in the room",
    "Phil Haddad's phone number corrected by Loretta from 555-010-0138 to 555-010-0139",
    "Patient's cell for text reminders: 555-010-0124 (house line initially given first); email wof58@mailbridge.com",
    "Apixaban referred to as both apixaban and Eliquis; prescribed by cardiologist Dr. Mbatha for A-fib; baby aspirin stopped in the spring when Eliquis started",
    "Halvard insurance authorization pending; office faxed twice; nurse said she would keep an eye on it",
    "Patient had a cold last week with lingering morning cough, no known fever; anesthesia cleared mild cough; fever threshold 100.4 or worsening symptoms triggers possible reschedule",
    "Family history: patient's father had colon cancer; Dr. Lindqvist-Amaro has family history in chart",
    "Prior anesthesia ~2019/2020 for knee surgery with post-op nausea - noted so anti-nausea can be provided",
    "A1c 7.2 in August; home morning sugars typically 120-130; if under 70 Friday morning, small clear apple juice allowed before cut-off",
    "Umbilical hernia raised in passing; note to be added for the doctor",
    "Weight finalized as 215 lb (patient joked 220); height 5'11\"; snoring noted, no diagnosed sleep apnea or CPAP",
    "Top partial denture - leave at home or a cup will be provided; wedding ring cannot be removed, will be taped",
    "Rescheduling requires at least 48 hours' notice due to waiting list",
    "Check-in at second-floor endoscopy desk, not main lobby; Entrance B parking off Wellstone Avenue, validated free",
    "Prep details: light low-fiber breakfast before 9 a.m. Thursday; first prep half 6 p.m. Thursday; second half 1:45 a.m. Friday, done by 2:45; nothing by mouth after 4:45 except lisinopril sip; Jell-O lemon or lime only (avoid red, purple, blue)"
  ]
}