{
  "call_type": "billing_dispute",
  "outcome": "callback",
  "sentiment_start": "neutral",
  "sentiment_end": "positive",
  "quality_score": 3,
  "quality_reasons": [
    "Verified identity with phone number and date of birth and correctly located the duplicate charges",
    "Corrected the copay amount from $40 to $45 after the caller provided her receipts",
    "Guaranteed a 48-hour refund that contradicts the stated 7-10 business day review policy",
    "Disclosed account balance and card details before completing date-of-birth verification",
    "Empathetic and courteous throughout, offered to add an account note and a confirmation callback"
  ],
  "flags": [
    {
      "type": "identity_verification",
      "description": "Account balance and payment card details were disclosed after only phone-number lookup, before the date of birth was collected.",
      "evidence": "your balance is showing ninety dollars right now, and there's two payments on the card ending in three-three-one-eight"
    },
    {
      "type": "unauthorized_commitment",
      "description": "Agent guaranteed a 48-hour refund despite stating the policy is 7-10 business days for review plus card refund time, a commitment he may not have authority to make.",
      "evidence": "don't worry about that, I'll make sure you get it back in forty-eight hours. Guaranteed."
    }
  ],
  "action_items": [
    {
      "owner": "agent (Marcus)",
      "task": "Submit refund request for the duplicate $45 charge and flag it for expedited 48-hour processing",
      "due": "during the call / within 48 hours as promised"
    },
    {
      "owner": "billing team",
      "task": "Call the patient back to confirm the refund went through",
      "due": "by Friday (2026-03-20)"
    },
    {
      "owner": "agent (Marcus)",
      "task": "Add an account note summarizing the duplicate-charge issue for future staff",
      "due": "during the call"
    }
  ],
  "summary_notes": "Patient Leontyne Asare-Whitfield (DOB 10/9/1988, phone 555-309-1184) was double-charged $45 for her visit on the 26th: once at the desk and once automatically by the new ClearPay portal (implemented end of February). Account balance showed $90 from the two payments on card ending 3318. Agent initially quoted $40 but corrected to $45 per the patient's receipts. Refund request submitted for the duplicate $45; agent promised funds within 48 hours (contrary to the 7-10 business day policy) and a billing team confirmation callback by Friday. No reference number was issued. Patient's daughter, also a patient seen the same week, may have the same duplicate charge and was advised to call if she sees one.",
  "notable_details": [
    "Copay amount corrected from $40 to $45 per patient's ClearPay email and desk receipt",
    "Duplicate charges both on card ending 3318, both tied to the visit on the 26th",
    "ClearPay portal went live end of February and auto-charged without the patient opting in",
    "No reference or ticket number was provided for the refund request; patient was told to use her phone number if calling back",
    "Patient's daughter was seen the same week and may have the same duplicate charge; she has not checked yet",
    "Patient reported the phone menu sent her somewhere odd when she pressed 2; she pressed 0 to reach an agent",
    "Refund policy as stated: 7-10 business days for billing team review, then card refund after that"
  ]
}