{
  "call_type": "insurance_verification",
  "outcome": "resolved",
  "sentiment_start": "neutral",
  "sentiment_end": "positive",
  "quality_score": 2,
  "quality_reasons": [
    "Identity verified (DOB and phone last-four) and patient consent obtained before the three-way payer call, handled well",
    "Agent told the patient he is 'fully covered' and will owe nothing, directly contradicting the payer's quoted $1,500 deductible ($1,120 remaining) and 20% coinsurance",
    "Agent booked the study at Ridgeline after the payer stated Ridgeline is out-of-network with no out-of-network sleep-study benefit and the authorization is valid only for Westbrook",
    "Agent implied a second night is 'covered' when the payer approved only one night and said a titration night requires a separate authorization with results",
    "Prior authorization PA-2026-0441973 was successfully obtained and the appointment was booked, but on incorrect terms"
  ],
  "flags": [
    {
      "type": "misinformation",
      "description": "Agent told the patient the study is fully covered with no out-of-pocket cost, contradicting the payer's quoted deductible and coinsurance.",
      "evidence": "Honestly, you're fully covered. It's approved, so you won't owe anything out of pocket."
    },
    {
      "type": "misinformation",
      "description": "Agent scheduled the sleep study at Ridgeline even though the payer stated Ridgeline is out-of-network with no out-of-network benefit and the authorization applies only to Westbrook.",
      "evidence": "The Westbrook location is in-network with Thistlecrest. The Ridgeline location is showing as out-of-network for this plan. ... Okay, you're booked at Ridgeline Sleep Lab, Tuesday, May twelfth."
    },
    {
      "type": "misinformation",
      "description": "Agent told the patient a second night is covered when the payer approved only one night and required a separate authorization for a titration night.",
      "evidence": "Oh, um, yeah, I think it's covered for the two. We'll see after the first one."
    }
  ],
  "action_items": [
    {
      "owner": "agent (Wendell, authorization coordinator)",
      "task": "Fax clinical notes to Thistlecrest Health Plan to finalize the pending authorization (payer requires within two business days; agent committed to doing it today)",
      "due": "today, 2026-04-21 (payer deadline: within two business days)"
    },
    {
      "owner": "agent (Wendell)",
      "task": "Send sleep lab instructions and a copy of today's call notes to the patient portal",
      "due": "unspecified"
    },
    {
      "owner": "patient",
      "task": "Attend sleep study at Ridgeline Sleep Lab on Tuesday, May 12 (arrival 8:30 p.m.); bring photo ID, insurance card, medication list, pajamas; no naps and no caffeine after noon that day",
      "due": "2026-05-12"
    }
  ],
  "summary_notes": "Outbound three-way call with Thistlecrest Health Plan. Patient's new insurance (effective 2026-04-01) verified active; member ID THC-50288144. Benefits quoted: $1,500 deductible ($380 met, $1,120 remaining), 20% coinsurance after; sleep studies covered in-network only. Westbrook in-network; Ridgeline out-of-network (not contracted). PA PA-2026-0441973 approved for one night of attended in-lab PSG (CPT 95810) at Westbrook, valid through 2026-06-30, pending clinical notes fax within two business days. Appointment booked at Ridgeline Sleep Lab, Tue 2026-05-12, arrival 8:30 p.m. NOTE: booking conflicts with payer's network restriction and auth terms; patient was incorrectly told he owes nothing and that a second night is covered. Patient prefers text reminders and electronic communication.",
  "notable_details": [
    "Patient changed jobs; new insurance is Thistlecrest Health Plan effective April 1, 2026; member ID THC-50288144; provider line 1-800-555-0199",
    "PA number PA-2026-0441973: one night, CPT 95810, Westbrook facility only, valid 2026-04-21 through 2026-06-30; approval pending receipt of clinical notes (fax within two business days via provider portal)",
    "Payer stated sleep studies are in-network only: Westbrook in-network, Ridgeline out-of-network and not contracted - yet the appointment was booked at Ridgeline for Tuesday, May 12, arrival 8:30 p.m., done ~6 a.m.",
    "Cost-share quoted by payer: $1,500 individual deductible, $380 met, $1,120 remaining, then 20% coinsurance; benefits quoted are not a guarantee of payment",
    "Clinical picture: suspected OSA, loud snoring, witnessed apneas, daytime sleepiness, Epworth 16, BMI 34, hypertension; Dr. Abernathy-Osei requested in-lab study for possible split-night titration; second (titration) night requires a separate authorization with diagnostic results",
    "Patient confirmed contact preferences: text reminders preferred, email (J... at yahoo) kept for statements, electronic communication preferred, mailing address and Ferris Avenue pharmacy unchanged, emergency contact unchanged",
    "Logistics shared: patient garage on east side level 2 with skybridge, front desk validates parking, check-in past the elevators by the fountain; cancellation via reply to reminder text",
    "Patient mentioned in passing: construction outside home for three weeks, four-year-old child, roommate, dog Biscuit, seasonal allergies, works from a call-center background, portal password unknown (reset available)"
  ]
}